{
  "gesture": "v_sign",
  "handedness": "right",
  "model": "myoHand",
  "joints": {
    "index_MCP_flex":  { "target": 0,  "tolerance": 15, "weight": 1.0 },
    "index_PIP_flex":  { "target": 0,  "tolerance": 15, "weight": 1.0 },
    "index_DIP_flex":  { "target": 0,  "tolerance": 15, "weight": 1.0 },

    "middle_MCP_flex": { "target": 0,  "tolerance": 15, "weight": 1.0 },
    "middle_PIP_flex": { "target": 0,  "tolerance": 15, "weight": 1.0 },
    "middle_DIP_flex": { "target": 0,  "tolerance": 15, "weight": 1.0 },

    "ring_MCP_flex":   { "target": 70, "tolerance": 15, "weight": 0.8 },
    "ring_PIP_flex":   { "target": 60, "tolerance": 15, "weight": 0.8 },
    "ring_DIP_flex":   { "target": 60, "tolerance": 15, "weight": 0.8 },

    "little_MCP_flex": { "target": 70, "tolerance": 15, "weight": 0.8 },
    "little_PIP_flex": { "target": 60, "tolerance": 15, "weight": 0.8 },
    "little_DIP_flex": { "target": 60, "tolerance": 15, "weight": 0.8 },

    "wrist_pitch":     { "target": 0,  "tolerance": 15, "weight": 0.3 },
    "wrist_yaw":       { "target": 0,  "tolerance": 15, "weight": 0.3 }
  },
  "relations": {
    "index_middle_abduction_deg": { "min": 15, "weight": 1.0 }
  },
  "contacts": { "require": [], "forbid": [ "index_tip:palm", "middle_tip:palm" ] },
  "orientation": { "palm_normal_world": "forward", "palm_normal_tolerance_deg": 25 },
  "stability": { "hold_steps": 50, "max_joint_drift_deg": 5, "max_tip_drift_mm": 5 },
  "weights": { "pose_error": 1.0, "relation_error": 1.0, "contact_error": 1.0, "orientation_error": 0.5, "effort": 0.01, "smoothness": 0.005, "rom_violation": 1000.0, "tendon_violation": 1000.0, "stability_violation": 100.0 },
  "notes": "Index & middle extended + abducted; ring/little flexed."
}